{
  "version": "1.0",
  "page": "Северный Дом — главная страница (строительство загородных домов премиум-класса)",
  "visual_intent": {
    "primary_focal_point": "Фотография завершённого современного дома при естественном дневном свете, доминирующая на первом экране",
    "secondary_focal_point": "Три цифры-доказательства (под ключ / 8 месяцев / гарантия 5 лет), типографически крупнее обычных заголовков",
    "content_entry": "Заголовок 'Строим дом для жизни, а не для отчёта' в нижней левой зоне фотографии",
    "emotional_quality": "Спокойный премиум — уверенность без суеты, как архитектурная монография, а не строительный лендинг"
  },
  "hero": {
    "composition": "full_bleed",
    "content_position": "bottom_left",
    "image_role": "dominant",
    "text_width": "narrow-left (~40-45% ширины экрана)",
    "cta": "primary",
    "nav": "overlay"
  },
  "section_sequence": [
    {
      "id": "hero",
      "purpose": "Формирует первое впечатление: готовый результат (дом), а не процесс строительства; мгновенно задаёт позиционирование и один главный шаг",
      "composition": "Фотография дома во всю ширину экрана; навигация поверх изображения сверху; в нижней левой трети — headline, одна короткая строка доказательства и один первичный CTA",
      "content_priority": "headline > короткий proof > один CTA; изображение является носителем смысла, текст вторичен по массе",
      "width": "full_bleed",
      "alignment": "left",
      "columns": 1,
      "overlap": true
    },
    {
      "id": "proof",
      "purpose": "Сразу после hero дать три ключевых числа, формирующих доверие: под ключ / 8 месяцев / гарантия 5 лет",
      "composition": "Компактная горизонтальная полоса из трёх доказательств, выстроенных в одну линию и разделённых тонкими вертикальными границами; цифра крупная, подпись приглушённая; никаких отдельно стоящих карточек",
      "content_priority": "цифры-доказательства доминируют, подписи вторичны",
      "width": "contained",
      "alignment": "mixed",
      "columns": 3,
      "overlap": false
    },
    {
      "id": "process",
      "purpose": "Объяснить механику работы предельно ясно — три простых шага без лишнего текста",
      "composition": "Асимметричная композиция: крупное изображение с одной стороны, с другой — узкий вертикальный список этапов с крупной нумерацией (один под другим, не сетка карточек)",
      "content_priority": "изображение и шаги уравновешены; нумерация этапов акцентирована",
      "width": "wide",
      "alignment": "mixed",
      "columns": 2,
      "overlap": true
    },
    {
      "id": "projects",
      "purpose": "Показать реальные завершённые объекты как каталог архитектурного бюро — прозрачность через фотографию, нумерацию и даты",
      "composition": "Редакционная галерея: изображения разного размера и высоты, сдвинутые относительно базовой оси, с подписями; нумерация проектов (001, 002, …) и год постройки прямо на фотографии; не сетка одинаковых карточек",
      "content_priority": "фотографии проектов первичны, подписи и метаданные вторичны",
      "width": "wide",
      "alignment": "mixed",
      "columns": 4,
      "overlap": false
    },
    {
      "id": "testimonial",
      "purpose": "Дать один сильный голос реального клиента, усиливающий доверие без шума",
      "composition": "Один отзыв в центре широкого пустого поля: крупная цитата со значительным воздухом вокруг, имя и роль клиента мелко под ней; никаких карточек и сетки",
      "content_priority": "цитата первична, атрибуция вторична",
      "width": "contained",
      "alignment": "center",
      "columns": 1,
      "overlap": false
    },
    {
      "id": "final_cta",
      "purpose": "Закрыть путь пользователя — спокойно привести к заявке на расчёт проекта без давления",
      "composition": "Спокойный contained-блок: крупный заголовок и короткий пояснительный текст сверху, ниже — чистая форма с минимальным числом полей; много whitespace вокруг, ничего не кричит",
      "content_priority": "заголовок и форма уравновешены, форма чистая и заметная, но не агрессивная",
      "width": "contained",
      "alignment": "left",
      "columns": 1,
      "overlap": false
    }
  ],
  "rhythm": [
    "dramatic",
    "compressed",
    "visual",
    "airy",
    "quiet",
    "transition"
  ],
  "grid": {
    "default": "Базовая сетка из узких колонок с широкими полями; контент сжат к одной оси, фотографии могут выходить за пределы контейнера",
    "break_rules": "На мобильных смысловая последовательность сохраняется: proof-полоса складывается в вертикальный стек, process теряет асимметрию (изображение над списком), галерея перестраивается в одноколоночную ленту; текст hero остаётся внизу слева и не переносится в центр"
  },
  "image_direction": {
    "hero": {
      "subject": "Готовый современный загородный дом в естественном окружении",
      "composition": "Архитектурная фотография: дом как главный объект, цельная светлая масса",
      "crop": "Широкий кадр (wide landscape), дом смещён к средней/верхней части кадра",
      "light": "Естественный дневной свет, мягкий, без резких теней",
      "negative_space": "Свободная зона в нижней левой части кадра для текста",
      "camera": "Фронтальная или слегка угловая точка, уровень глаз"
    },
    "sections": [
      {
        "section": "process",
        "role": "supporting",
        "subject": "Фрагмент строящегося или завершённого дома — чистая архитектурная деталь, не 'стройка' с кранами",
        "composition": "Крупный план детали/фасада, вертикальная или квадратная ориентация",
        "crop": "Плотный кадр на детали, без широкого контекста",
        "light": "Дневной свет"
      },
      {
        "section": "projects",
        "role": "primary",
        "subject": "Реальные завершённые загородные дома, по одному на проект",
        "composition": "Каждый объект целиком в собственном окружении; смешанные ориентации и размеры для редакционной подачи",
        "crop": "Разные кадры — некоторые широкоформатные, некоторые вертикальные; год постройки выносится на изображение",
        "light": "Естественный дневной свет, единая световая температура между кадрами"
      }
    ]
  },
  "forbidden": [
    "Не использовать centered generic hero — заголовок обязан быть в нижней левой зоне поверх фотографии, а не по центру",
    "Не превращать proof-полосу в три отдельные одинаковые карточки — только одна линия доказательств с тонкими разделителями",
    "Не превращать галерею проектов в сетку одинаковых карточек — нужна редакционная подача с разными размерами и нумерацией",
    "Не добавлять иконки на каждый пункт process — этапы передаются крупной нумерацией, а не иконками",
    "Не использовать стоковые фото строек/строителей/кранов — только завершённые дома при дневном свете",
    "Не добавлять декоративные элементы (градиенты, тяжёлые тени, свечения) — только чистые плоскости, чтобы фотографии домов доминировали"
  ]
}